{
  "$id": "urn:ratatoskr:contracts:github:v1:RepositoryActionRequest",
  "$schema": "https://json-schema.org/draft/2020-12/schema",
  "title": "RepositoryActionRequest",
  "type": "object",
  "properties": {
    "account_ref": {
      "description": "Acting connected account when required by the mode.",
      "anyOf": [
        {
          "$ref": "#/$defs/GitHubAccountRef"
        },
        {
          "type": "null"
        }
      ]
    },
    "confirmation_evidence_ref": {
      "description": "Opaque reference proving the caller completed its confirmation flow.",
      "$ref": "#/$defs/ConfirmationEvidenceRef"
    },
    "idempotency_key": {
      "description": "Opaque key that gives one logical action a stable request identity.",
      "$ref": "#/$defs/RepositoryActionIdempotencyKey"
    },
    "mode": {
      "description": "Requested repository mode.",
      "$ref": "#/$defs/RepositoryActionCapability"
    },
    "target": {
      "description": "Exact stable target returned by preview.",
      "$ref": "#/$defs/RepositoryPreviewTarget"
    }
  },
  "additionalProperties": false,
  "required": [
    "confirmation_evidence_ref",
    "idempotency_key",
    "mode",
    "target"
  ],
  "x-ratatoskr-provenance": {
    "canonical_source": "ratatoskr_github_contracts::RepositoryActionRequest",
    "contract_id": "github.repository_action_request",
    "contract_major_version": 1,
    "generated": "DO NOT EDIT — generated by contractsc from the canonical Rust source. Change the Rust type and run `cargo contracts generate`.",
    "generator": "contractsc",
    "generator_version": "0.1.0",
    "schemars_version": "1.2.2",
    "source_digest": "sha256:67b1d27763ac31f68073b723af28a805f13bcb202ba50c9310b8eb2a27c855e4",
    "validation_note": "This schema is a LOWER BOUND on validity. Cross-field invariants and canonical-form rules are enforced by the canonical Rust type; see fixtures/invalid-expectations.toml for which layer rejects what."
  },
  "$defs": {
    "ConfirmationEvidenceRef": {
      "title": "ConfirmationEvidenceRef",
      "description": "Opaque bounded reference to the caller's completed confirmation evidence.",
      "type": "string",
      "examples": [
        "telegram-confirmation:018f0000-0000-7000-8000-000000000605"
      ],
      "maxLength": 161,
      "pattern": "^[a-z][a-z0-9_-]{0,31}:[A-Za-z0-9][A-Za-z0-9._~:@+-]{0,127}$"
    },
    "GitHubAccountRef": {
      "title": "GitHubAccountRef",
      "description": "Opaque reference to one connected GitHub account; never a credential.",
      "type": "string",
      "examples": [
        "github-account:018f0000-0000-7000-8000-000000000604"
      ],
      "maxLength": 51,
      "pattern": "^github-account:[0-9a-f]{8}-[0-9a-f]{4}-[0-9a-f]{4}-[0-9a-f]{4}-[0-9a-f]{12}$"
    },
    "GitHubRepositoryNumericId": {
      "title": "GitHubRepositoryNumericId",
      "description": "Stable positive GitHub numeric repository identity.",
      "type": "integer",
      "examples": [
        42
      ],
      "minimum": 1
    },
    "GitHubRepositoryUrl": {
      "title": "GitHubRepositoryUrl",
      "description": "Canonical HTTPS GitHub repository URL with exactly an owner and repository path.",
      "type": "string",
      "examples": [
        "https://github.com/owner/repository"
      ],
      "maxLength": 220,
      "pattern": "^https://github\\.com/[A-Za-z0-9][A-Za-z0-9_.-]{0,99}/[A-Za-z0-9][A-Za-z0-9_.-]{0,99}$"
    },
    "RepositoryActionCapability": {
      "description": "Repository actions currently available to the authenticated caller.",
      "oneOf": [
        {
          "description": "Catalog metadata only.",
          "type": "string",
          "const": "metadata"
        },
        {
          "description": "Catalog metadata plus desired backup tracking.",
          "type": "string",
          "const": "track"
        },
        {
          "description": "Provider star plus the catalog and desired backup steps.",
          "type": "string",
          "const": "star"
        }
      ]
    },
    "RepositoryActionIdempotencyKey": {
      "title": "RepositoryActionIdempotencyKey",
      "description": "Bounded opaque identity of one logical repository action.",
      "type": "string",
      "examples": [
        "telegram-github-action.018f0000-0000-7000-8000-000000000606"
      ],
      "maxLength": 128,
      "pattern": "^[A-Za-z0-9][A-Za-z0-9._~:@+-]{0,127}$"
    },
    "RepositoryFullName": {
      "title": "RepositoryFullName",
      "description": "GitHub owner/name alias observed for the repository revision.",
      "type": "string",
      "examples": [
        "owner/repository"
      ],
      "maxLength": 201,
      "pattern": "^[A-Za-z0-9][A-Za-z0-9_.-]{0,99}/[A-Za-z0-9][A-Za-z0-9_.-]{0,99}$"
    },
    "RepositoryPreviewTarget": {
      "description": "Stable provider identity and current display alias returned by a preview.",
      "type": "object",
      "properties": {
        "canonical_url": {
          "description": "Canonical HTTPS GitHub repository URL.",
          "$ref": "#/$defs/GitHubRepositoryUrl"
        },
        "github_repository_numeric_id": {
          "description": "Stable positive GitHub numeric repository identity.",
          "$ref": "#/$defs/GitHubRepositoryNumericId"
        },
        "repository_full_name": {
          "description": "Current GitHub owner/name alias.",
          "$ref": "#/$defs/RepositoryFullName"
        }
      },
      "additionalProperties": false,
      "required": [
        "canonical_url",
        "github_repository_numeric_id",
        "repository_full_name"
      ]
    }
  }
}
